-- Model-output: Claude Fable 5
-- Model-output: Claude Opus 4.8
/*
 * Regression tests for bugs found in the 2026-08 code review
 * (ai-code-reviews/claude.md).  Section markers below refer to that
 * document's numbering.
 */
/* Run tests as unprivileged user */
SET ROLE TO periods_unprivileged_user;
/*
 * §2.1: dropping an application-time period must not tear down the table's
 * SYSTEM VERSIONING machinery, which belongs to the system_time period.
 */
CREATE TABLE dp_sysver (id integer PRIMARY KEY, val text, vs date, ve date);
SELECT periods.add_period('dp_sysver', 'validity', 'vs', 've');
 add_period 
------------
 t
(1 row)

SELECT periods.add_system_time_period('dp_sysver');
 add_system_time_period 
------------------------
 t
(1 row)

SELECT periods.add_system_versioning('dp_sysver');
NOTICE:  history table "dp_sysver_history" created for "dp_sysver", be sure to index it properly
 add_system_versioning 
-----------------------
 
(1 row)

INSERT INTO dp_sysver (id, val, vs, ve) VALUES (1, 'a', '2000-01-01', '2010-01-01');
SELECT periods.drop_period('dp_sysver', 'validity');
 drop_period 
-------------
 t
(1 row)

/* The system_time period, its triggers, and its constraint must survive. */
SELECT period_name FROM periods.periods WHERE table_name = 'dp_sysver'::regclass ORDER BY period_name;
 period_name 
-------------
 system_time
(1 row)

SELECT period_name FROM periods.system_time_periods WHERE table_name = 'dp_sysver'::regclass;
 period_name 
-------------
 system_time
(1 row)

SELECT count(*) AS sysver_rows FROM periods.system_versioning WHERE table_name = 'dp_sysver'::regclass;
 sysver_rows 
-------------
           1
(1 row)

SELECT count(*) AS row_triggers FROM pg_catalog.pg_trigger WHERE tgrelid = 'dp_sysver'::regclass AND NOT tgisinternal;
 row_triggers 
--------------
            3
(1 row)

SELECT count(*) AS infinity_constraints
FROM periods.system_time_periods AS stp
JOIN pg_catalog.pg_constraint AS c ON (c.conrelid, c.conname) = (stp.table_name, stp.infinity_check_constraint)
WHERE stp.table_name = 'dp_sysver'::regclass;
 infinity_constraints 
----------------------
                    1
(1 row)

/* History must still be written (the INSERT above was an earlier transaction). */
UPDATE dp_sysver SET val = 'b' WHERE id = 1;
SELECT val FROM dp_sysver_history;
 val 
-----
 a
(1 row)

SELECT periods.drop_system_versioning('dp_sysver', drop_behavior => 'CASCADE', purge => true);
 drop_system_versioning 
------------------------
 t
(1 row)

DROP TABLE dp_sysver;
/*
 * §2.3(b): update_portion_of() must match the edited row by its primary key
 * alone.  Matching on the columns of every constraint means a NULL in any
 * CHECK/UNIQUE/FOREIGN KEY-constrained column makes the central UPDATE match
 * nothing, while the pre/post slices are still inserted: the edit is silently
 * lost and the periods overlap.
 */
CREATE TABLE fp_nullable (
    id serial PRIMARY KEY,
    val integer,
    note text CHECK (note <> 'wrong'),
    s integer,
    e integer
);
SELECT periods.add_period('fp_nullable', 'p', 's', 'e');
 add_period 
------------
 t
(1 row)

SELECT periods.add_for_portion_view('fp_nullable', 'p');
 add_for_portion_view 
----------------------
 t
(1 row)

INSERT INTO fp_nullable (val, note, s, e) VALUES (100, NULL, 10, 40);
UPDATE fp_nullable__for_portion_of_p SET val = 999, s = 20, e = 30;
/* Expect [10,20) val 100, [20,30) val 999, [30,40) val 100; note NULL in all. */
SELECT id, val, note, s, e FROM fp_nullable ORDER BY s, e, id;
 id | val | note | s  | e  
----+-----+------+----+----
  2 | 100 |      | 10 | 20
  1 | 999 |      | 20 | 30
  3 | 100 |      | 30 | 40
(3 rows)

SELECT periods.drop_period('fp_nullable', 'p');
 drop_period 
-------------
 t
(1 row)

DROP TABLE fp_nullable;
/*
 * §4.1: insert_into_history()'s plan cache must re-plan exactly when the
 * history table's qualified name changes: not on every write (which leaks
 * one kept plan per history-writing statement), and never running a stale
 * plan after the history table changed both schema and name.
 */
CREATE TABLE pc_leak (id integer PRIMARY KEY, val integer);
SELECT periods.add_system_time_period('pc_leak');
 add_system_time_period 
------------------------
 t
(1 row)

SELECT periods.add_system_versioning('pc_leak');
NOTICE:  history table "pc_leak_history" created for "pc_leak", be sure to index it properly
 add_system_versioning 
-----------------------
 
(1 row)

INSERT INTO pc_leak (id, val) VALUES (1, 0);
UPDATE pc_leak SET val = 1;
UPDATE pc_leak SET val = 2;
UPDATE pc_leak SET val = 3;
UPDATE pc_leak SET val = 4;
UPDATE pc_leak SET val = 5;
/*
 * Count this backend's cached history INSERT plans: one per UPDATE when
 * leaking, exactly one when behaving.  pg_backend_memory_contexts needs a
 * superuser and PostgreSQL 14; on older servers just report the good value.
 */
RESET ROLE;
DO $do$
DECLARE
    n bigint := 1;
BEGIN
    IF current_setting('server_version_num')::integer >= 140000 THEN
        SELECT count(*) INTO n
        FROM pg_backend_memory_contexts
        WHERE ident LIKE 'INSERT INTO %pc_leak_history%';
    END IF;
    RAISE NOTICE 'cached history insert plans: %', n;
END;
$do$;
NOTICE:  cached history insert plans: 1
/* Changing both schema and name of the history table must cause a re-plan. */
CREATE SCHEMA pc_leak_hs;
ALTER TABLE pc_leak_history SET SCHEMA pc_leak_hs;
ALTER TABLE pc_leak_hs.pc_leak_history RENAME TO relocated_history;
UPDATE pc_leak SET val = 6;
SELECT val FROM pc_leak_hs.relocated_history ORDER BY val;
 val 
-----
   0
   1
   2
   3
   4
   5
(6 rows)

SELECT periods.drop_system_versioning('pc_leak', drop_behavior => 'CASCADE', purge => true);
 drop_system_versioning 
------------------------
 t
(1 row)

DROP TABLE pc_leak;
DROP SCHEMA pc_leak_hs;
SET ROLE TO periods_unprivileged_user;
/*
 * §2.2 (github issue #27): deleting or updating a referenced row must not
 * orphan children whose periods lie strictly inside the removed interval.
 * The old parent-side check looked only for children *containing* the whole
 * removed interval.
 */
CREATE TABLE fk_parent (id integer, s integer, e integer);
SELECT periods.add_period('fk_parent', 'p', 's', 'e');
 add_period 
------------
 t
(1 row)

SELECT periods.add_unique_key('fk_parent', ARRAY['id'], 'p', key_name => 'fk_parent_id_p');
 add_unique_key 
----------------
 fk_parent_id_p
(1 row)

CREATE TABLE fk_child (id integer, parent_id integer, s integer, e integer);
SELECT periods.add_period('fk_child', 'p', 's', 'e');
 add_period 
------------
 t
(1 row)

SELECT periods.add_foreign_key('fk_child', ARRAY['parent_id'], 'p', 'fk_parent_id_p', key_name => 'fk_child_parent_id_p');
   add_foreign_key    
----------------------
 fk_child_parent_id_p
(1 row)

INSERT INTO fk_parent VALUES (1, 0, 100);
INSERT INTO fk_child VALUES (1, 1, 30, 40);
/* Deleting or shrinking the parent across the child must be blocked. */
DELETE FROM fk_parent WHERE id = 1;
ERROR:  update or delete on table "fk_parent" violates foreign key constraint "fk_child_parent_id_p" on table "fk_child"
CONTEXT:  PL/pgSQL function periods.validate_foreign_key_old_row(name,jsonb,boolean) line 151 at RAISE
SQL statement "SELECT periods.validate_foreign_key_old_row(TG_ARGV[0], jold, false)"
PL/pgSQL function periods.uk_delete_check() line 22 at PERFORM
UPDATE fk_parent SET s = 35 WHERE id = 1;
ERROR:  update or delete on table "fk_parent" violates foreign key constraint "fk_child_parent_id_p" on table "fk_child"
CONTEXT:  PL/pgSQL function periods.validate_foreign_key_old_row(name,jsonb,boolean) line 151 at RAISE
SQL statement "SELECT periods.validate_foreign_key_old_row(TG_ARGV[0], jold, true)"
PL/pgSQL function periods.uk_update_check() line 23 at PERFORM
/* Changing the key while a child references it must be blocked. */
UPDATE fk_parent SET id = 2 WHERE id = 1;
ERROR:  update or delete on table "fk_parent" violates foreign key constraint "fk_child_parent_id_p" on table "fk_child"
CONTEXT:  PL/pgSQL function periods.validate_foreign_key_old_row(name,jsonb,boolean) line 151 at RAISE
SQL statement "SELECT periods.validate_foreign_key_old_row(TG_ARGV[0], jold, true)"
PL/pgSQL function periods.uk_update_check() line 23 at PERFORM
/* Changes that keep the child covered are allowed. */
UPDATE fk_parent SET s = 10, e = 90 WHERE id = 1;
SELECT id, s, e FROM fk_parent ORDER BY id, s;
 id | s  | e  
----+----+----
  1 | 10 | 90
(1 row)

SELECT id, parent_id, s, e FROM fk_child ORDER BY id, s;
 id | parent_id | s  | e  
----+-----------+----+----
  1 |         1 | 30 | 40
(1 row)

/* NO ACTION is deferred: replacing coverage within a transaction is allowed. */
BEGIN;
DELETE FROM fk_parent WHERE id = 1;
INSERT INTO fk_parent VALUES (1, 10, 35), (1, 35, 90);
COMMIT;
SELECT id, s, e FROM fk_parent ORDER BY id, s;
 id | s  | e  
----+----+----
  1 | 10 | 35
  1 | 35 | 90
(2 rows)

/* Removing an interior piece of the coverage must still fail at commit. */
BEGIN;
DELETE FROM fk_parent WHERE (id, s) = (1, 35);
COMMIT;
ERROR:  update or delete on table "fk_parent" violates foreign key constraint "fk_child_parent_id_p" on table "fk_child"
CONTEXT:  PL/pgSQL function periods.validate_foreign_key_old_row(name,jsonb,boolean) line 151 at RAISE
SQL statement "SELECT periods.validate_foreign_key_old_row(TG_ARGV[0], jold, false)"
PL/pgSQL function periods.uk_delete_check() line 22 at PERFORM
SELECT id, s, e FROM fk_parent ORDER BY id, s;
 id | s  | e  
----+----+----
  1 | 10 | 35
  1 | 35 | 90
(2 rows)

/* Once the child is gone, the parent can go too. */
DELETE FROM fk_child;
DELETE FROM fk_parent;
/* RESTRICT differs from NO ACTION only in timing in this extension. */
CREATE TABLE fkr_parent (id integer, s integer, e integer);
SELECT periods.add_period('fkr_parent', 'p', 's', 'e');
 add_period 
------------
 t
(1 row)

SELECT periods.add_unique_key('fkr_parent', ARRAY['id'], 'p', key_name => 'fkr_parent_id_p');
 add_unique_key  
-----------------
 fkr_parent_id_p
(1 row)

CREATE TABLE fkr_child (id integer, parent_id integer, s integer, e integer);
SELECT periods.add_period('fkr_child', 'p', 's', 'e');
 add_period 
------------
 t
(1 row)

SELECT periods.add_foreign_key('fkr_child', ARRAY['parent_id'], 'p', 'fkr_parent_id_p',
    key_name => 'fkr_child_parent_id_p', update_action => 'RESTRICT', delete_action => 'RESTRICT');
    add_foreign_key    
-----------------------
 fkr_child_parent_id_p
(1 row)

INSERT INTO fkr_parent VALUES (1, 0, 100);
INSERT INTO fkr_child VALUES (1, 1, 30, 40);
DELETE FROM fkr_parent WHERE id = 1;
ERROR:  update or delete on table "fkr_parent" violates foreign key constraint "fkr_child_parent_id_p" on table "fkr_child"
CONTEXT:  PL/pgSQL function periods.validate_foreign_key_old_row(name,jsonb,boolean) line 151 at RAISE
SQL statement "SELECT periods.validate_foreign_key_old_row(TG_ARGV[0], jold, false)"
PL/pgSQL function periods.uk_delete_check() line 22 at PERFORM
/* Extending the parent period keeps the child covered and is allowed. */
UPDATE fkr_parent SET e = 200 WHERE id = 1;
SELECT id, s, e FROM fkr_parent ORDER BY id, s;
 id | s |  e  
----+---+-----
  1 | 0 | 200
(1 row)

/* A self-referencing foreign key. */
CREATE TABLE fk_selfref (id integer, mgr integer, s integer, e integer);
SELECT periods.add_period('fk_selfref', 'p', 's', 'e');
 add_period 
------------
 t
(1 row)

SELECT periods.add_unique_key('fk_selfref', ARRAY['id'], 'p', key_name => 'fk_selfref_id_p');
 add_unique_key  
-----------------
 fk_selfref_id_p
(1 row)

SELECT periods.add_foreign_key('fk_selfref', ARRAY['mgr'], 'p', 'fk_selfref_id_p', key_name => 'fk_selfref_mgr_p');
 add_foreign_key  
------------------
 fk_selfref_mgr_p
(1 row)

INSERT INTO fk_selfref VALUES (1, 1, 0, 50);
INSERT INTO fk_selfref VALUES (2, 1, 10, 20);
/* id 1 is still referenced by id 2. */
DELETE FROM fk_selfref WHERE id = 1;
ERROR:  update or delete on table "fk_selfref" violates foreign key constraint "fk_selfref_mgr_p" on table "fk_selfref"
CONTEXT:  PL/pgSQL function periods.validate_foreign_key_old_row(name,jsonb,boolean) line 151 at RAISE
SQL statement "SELECT periods.validate_foreign_key_old_row(TG_ARGV[0], jold, false)"
PL/pgSQL function periods.uk_delete_check() line 22 at PERFORM
/* id 2 is referenced by nobody. */
DELETE FROM fk_selfref WHERE id = 2;
/* Now id 1 references only itself, and deleting it removes both sides. */
DELETE FROM fk_selfref WHERE id = 1;
SELECT id, mgr, s, e FROM fk_selfref ORDER BY id, s;
 id | mgr | s | e 
----+-----+---+---
(0 rows)

/*
 * Same-named referencing and referenced columns: the coverage query used to
 * correlate them without table qualification, so "id = id" collapsed into a
 * tautology and the key filter vanished, accepting orphans of other keys and
 * spuriously rejecting valid rows once different keys' periods overlapped.
 */
CREATE TABLE sn_parent (id integer, s integer, e integer);
SELECT periods.add_period('sn_parent', 'p', 's', 'e');
 add_period 
------------
 t
(1 row)

SELECT periods.add_unique_key('sn_parent', ARRAY['id'], 'p', key_name => 'sn_parent_id_p');
 add_unique_key 
----------------
 sn_parent_id_p
(1 row)

CREATE TABLE sn_child (id integer, s integer, e integer);
SELECT periods.add_period('sn_child', 'p', 's', 'e');
 add_period 
------------
 t
(1 row)

SELECT periods.add_foreign_key('sn_child', ARRAY['id'], 'p', 'sn_parent_id_p', key_name => 'sn_child_id_p');
 add_foreign_key 
-----------------
 sn_child_id_p
(1 row)

INSERT INTO sn_parent VALUES (1, 0, 20);
/* A child with a key that has no parent at all must be rejected. */
INSERT INTO sn_child VALUES (999, 5, 10);
ERROR:  insert or update on table "sn_child" violates foreign key constraint "sn_child_id_p"
CONTEXT:  PL/pgSQL function periods.validate_foreign_key_new_row(name,jsonb) line 130 at RAISE
SQL statement "SELECT periods.validate_foreign_key_new_row(TG_ARGV[0], jnew)"
PL/pgSQL function periods.fk_insert_check() line 20 at PERFORM
/* A properly covered child is accepted. */
INSERT INTO sn_child VALUES (1, 5, 10);
INSERT INTO sn_parent VALUES (2, 10, 50);
/* Overlapping periods of *other* keys must not confuse the check. */
INSERT INTO sn_child VALUES (1, 12, 18);
SELECT id, s, e FROM sn_child ORDER BY id, s;
 id | s  | e  
----+----+----
  1 |  5 | 10
  1 | 12 | 18
(2 rows)

/* Re-adding the foreign key revalidates existing data with the same query. */
SELECT periods.drop_foreign_key('sn_child', 'sn_child_id_p');
 drop_foreign_key 
------------------
 t
(1 row)

SELECT periods.add_foreign_key('sn_child', ARRAY['id'], 'p', 'sn_parent_id_p', key_name => 'sn_child_id_p');
 add_foreign_key 
-----------------
 sn_child_id_p
(1 row)

/* Clean up all foreign key test objects. */
SELECT periods.drop_period('fk_child', 'p', 'CASCADE');
 drop_period 
-------------
 t
(1 row)

DROP TABLE fk_child;
SELECT periods.drop_period('fk_parent', 'p', 'CASCADE');
 drop_period 
-------------
 t
(1 row)

DROP TABLE fk_parent;
SELECT periods.drop_period('fkr_child', 'p', 'CASCADE');
 drop_period 
-------------
 t
(1 row)

DROP TABLE fkr_child;
SELECT periods.drop_period('fkr_parent', 'p', 'CASCADE');
 drop_period 
-------------
 t
(1 row)

DROP TABLE fkr_parent;
SELECT periods.drop_period('fk_selfref', 'p', 'CASCADE');
 drop_period 
-------------
 t
(1 row)

DROP TABLE fk_selfref;
SELECT periods.drop_period('sn_child', 'p', 'CASCADE');
 drop_period 
-------------
 t
(1 row)

DROP TABLE sn_child;
SELECT periods.drop_period('sn_parent', 'p', 'CASCADE');
 drop_period 
-------------
 t
(1 row)

DROP TABLE sn_parent;
/*
 * §5.2: the bounds check constraint of a period must be protected from being
 * dropped (like the system_time infinity constraint already is), and
 * drop_period(..., purge => true) must not trip over its own protection, a
 * recursive teardown, or a constraint shared by another period.
 */
CREATE TABLE bcp (id integer, s integer, e integer);
SELECT periods.add_period('bcp', 'p', 's', 'e');
 add_period 
------------
 t
(1 row)

/* Dropping the bounds constraint out from under the period must be blocked. */
ALTER TABLE bcp DROP CONSTRAINT bcp_p_check;
ERROR:  cannot drop constraint "bcp_p_check" on table "bcp" because it is used in period "p"
CONTEXT:  PL/pgSQL function periods.drop_protection() line 304 at RAISE
/* And purging the period must work. */
SELECT periods.drop_period('bcp', 'p', purge => true);
 drop_period 
-------------
 t
(1 row)

DROP TABLE bcp;
/* CASCADE+purge of system_time with versioning tears down through
 * drop_system_versioning, which recurses into drop_period; the bounds
 * constraint must not be dropped twice. */
CREATE TABLE dtd (id integer PRIMARY KEY, val text);
SELECT periods.add_system_time_period('dtd');
 add_system_time_period 
------------------------
 t
(1 row)

SELECT periods.add_system_versioning('dtd');
NOTICE:  history table "dtd_history" created for "dtd", be sure to index it properly
 add_system_versioning 
-----------------------
 
(1 row)

SELECT periods.drop_period('dtd', 'system_time', 'CASCADE', purge => true);
 drop_period 
-------------
 t
(1 row)

SELECT periods.drop_system_versioning('dtd', drop_behavior => 'CASCADE', purge => true);
NOTICE:  table dtd does not have SYSTEM VERSIONING
 drop_system_versioning 
------------------------
 f
(1 row)

SELECT periods.drop_period('dtd', 'system_time', purge => true);
NOTICE:  period system_time not found on table dtd
 drop_period 
-------------
 f
(1 row)

DROP TABLE dtd;
/* Two periods adopting the same pre-existing CHECK constraint: purging one
 * period must leave the constraint for the other. */
CREATE TABLE shc (id integer, s integer, e integer, CONSTRAINT shc_se_check CHECK (s < e));
SELECT periods.add_period('shc', 'p1', 's', 'e');
 add_period 
------------
 t
(1 row)

SELECT periods.add_period('shc', 'p2', 's', 'e');
 add_period 
------------
 t
(1 row)

SELECT periods.drop_period('shc', 'p1', purge => true);
 drop_period 
-------------
 t
(1 row)

SELECT count(*) AS constraint_survives FROM pg_catalog.pg_constraint
    WHERE (conrelid, conname) = ('shc'::regclass, 'shc_se_check');
 constraint_survives 
---------------------
                   1
(1 row)

SELECT periods.drop_period('shc', 'p2', purge => true);
 drop_period 
-------------
 t
(1 row)

SELECT count(*) AS constraint_purged FROM pg_catalog.pg_constraint
    WHERE (conrelid, conname) = ('shc'::regclass, 'shc_se_check');
 constraint_purged 
-------------------
                 0
(1 row)

DROP TABLE shc;
/*
 * §5.1: period bound columns are by definition NOT NULL and the rest of the
 * code relies on it, so health_checks() must reject dropping that.
 * Otherwise a NULL bound slips past the bounds CHECK constraint (NULL is not
 * false) and produces a nonsense period.
 */
CREATE TABLE nn (id integer, s integer, e integer);
SELECT periods.add_period('nn', 'p', 's', 'e');
 add_period 
------------
 t
(1 row)

ALTER TABLE nn ALTER COLUMN s DROP NOT NULL;
ERROR:  cannot drop NOT NULL from column "s" of table "nn" because it is part of the period "p"
CONTEXT:  PL/pgSQL function periods.health_checks() line 320 at RAISE
INSERT INTO nn VALUES (1, NULL, 10);
ERROR:  null value in column "s" of relation "nn" violates not-null constraint
DETAIL:  Failing row contains (1, null, 10).
SELECT id, s, e FROM nn ORDER BY id;
 id | s | e 
----+---+---
(0 rows)

SELECT periods.drop_period('nn', 'p');
 drop_period 
-------------
 t
(1 row)

DROP TABLE nn;
/*
 * §6.1: truncate_system_versioning() read the history table's regclass into a
 * name-typed variable, truncating the qualified form at 63 bytes, so history
 * tables whose schema-qualified name is longer could not be truncated.
 */
RESET ROLE;
CREATE SCHEMA history_schema_with_quite_a_long_name_indeed;
CREATE TABLE trunc_sv (id integer PRIMARY KEY, val integer);
SELECT periods.add_system_time_period('trunc_sv');
 add_system_time_period 
------------------------
 t
(1 row)

SELECT periods.add_system_versioning('trunc_sv');
NOTICE:  history table "trunc_sv_history" created for "trunc_sv", be sure to index it properly
 add_system_versioning 
-----------------------
 
(1 row)

ALTER TABLE trunc_sv_history SET SCHEMA history_schema_with_quite_a_long_name_indeed;
ALTER TABLE history_schema_with_quite_a_long_name_indeed.trunc_sv_history
    RENAME TO history_table_with_quite_a_long_name_as_well;
INSERT INTO trunc_sv (id, val) VALUES (1, 10);
UPDATE trunc_sv SET val = 20;
SELECT count(*) AS history_rows_before
    FROM history_schema_with_quite_a_long_name_indeed.history_table_with_quite_a_long_name_as_well;
 history_rows_before 
---------------------
                   1
(1 row)

TRUNCATE trunc_sv;
SELECT count(*) AS history_rows_after
    FROM history_schema_with_quite_a_long_name_indeed.history_table_with_quite_a_long_name_as_well;
 history_rows_after 
--------------------
                  0
(1 row)

SELECT periods.drop_system_versioning('trunc_sv', drop_behavior => 'CASCADE', purge => true);
 drop_system_versioning 
------------------------
 t
(1 row)

DROP TABLE trunc_sv;
DROP SCHEMA history_schema_with_quite_a_long_name_indeed;
SET ROLE TO periods_unprivileged_user;
/*
 * §2.3(a): update_portion_of() stripped ALL primary key columns from the
 * re-inserted pre/post slices on the assumption that they regenerate.  For
 * primary key columns without a default — the temporal-key shape
 * PRIMARY KEY (id, s, e), or a plain integer PK — nothing regenerates them,
 * and the slice INSERT failed on a NULL primary key column.
 */
CREATE TABLE fp_tpk (id integer, val text, s integer, e integer, PRIMARY KEY (id, s, e));
SELECT periods.add_period('fp_tpk', 'p', 's', 'e');
 add_period 
------------
 t
(1 row)

SELECT periods.add_for_portion_view('fp_tpk', 'p');
 add_for_portion_view 
----------------------
 t
(1 row)

INSERT INTO fp_tpk VALUES (1, 'a', 10, 40);
UPDATE fp_tpk__for_portion_of_p SET val = 'b', s = 20, e = 30;
SELECT id, val, s, e FROM fp_tpk ORDER BY s;
 id | val | s  | e  
----+-----+----+----
  1 | a   | 10 | 20
  1 | b   | 20 | 30
  1 | a   | 30 | 40
(3 rows)

SELECT periods.drop_period('fp_tpk', 'p');
 drop_period 
-------------
 t
(1 row)

DROP TABLE fp_tpk;
/* A single-column primary key cannot survive a row split; the error should
 * say so honestly (duplicate key) rather than fail on a NULL id. */
CREATE TABLE fp_spk (id integer PRIMARY KEY, val text, s integer, e integer);
SELECT periods.add_period('fp_spk', 'p', 's', 'e');
 add_period 
------------
 t
(1 row)

SELECT periods.add_for_portion_view('fp_spk', 'p');
 add_for_portion_view 
----------------------
 t
(1 row)

INSERT INTO fp_spk VALUES (1, 'a', 10, 40);
UPDATE fp_spk__for_portion_of_p SET val = 'b', s = 20, e = 30;
ERROR:  duplicate key value violates unique constraint "fp_spk_pkey"
DETAIL:  Key (id)=(1) already exists.
CONTEXT:  SQL statement "INSERT INTO fp_spk (e, id, s, val) SELECT r.e, r.id, r.s, r.val FROM pg_catalog.jsonb_populate_record(NULL::fp_spk, '{"e": 20, "s": 10, "id": 1, "val": "a"}') AS r"
PL/pgSQL function periods.update_portion_of() line 233 at EXECUTE
SELECT id, val, s, e FROM fp_spk ORDER BY s;
 id | val | s  | e  
----+-----+----+----
  1 | a   | 10 | 40
(1 row)

SELECT periods.drop_period('fp_spk', 'p');
 drop_period 
-------------
 t
(1 row)

DROP TABLE fp_spk;
/* Period bound columns must never be treated as regenerating, even when they
 * are in the primary key and have DEFAULTs: the slices carry freshly
 * computed bounds. */
CREATE TABLE fp_dpk (id serial, val text, s integer DEFAULT 0, e integer DEFAULT 100,
                     PRIMARY KEY (id, s, e));
SELECT periods.add_period('fp_dpk', 'p', 's', 'e');
 add_period 
------------
 t
(1 row)

SELECT periods.add_for_portion_view('fp_dpk', 'p');
 add_for_portion_view 
----------------------
 t
(1 row)

INSERT INTO fp_dpk (val, s, e) VALUES ('a', 10, 40);
UPDATE fp_dpk__for_portion_of_p SET val = 'b', s = 20, e = 30;
SELECT id, val, s, e FROM fp_dpk ORDER BY s, e, id;
 id | val | s  | e  
----+-----+----+----
  2 | a   | 10 | 20
  1 | b   | 20 | 30
  3 | a   | 30 | 40
(3 rows)

SELECT periods.drop_period('fp_dpk', 'p');
 drop_period 
-------------
 t
(1 row)

DROP TABLE fp_dpk;
/* A primary key regenerated by a DOMAIN default (atthasdef is false for
 * those) must keep regenerating. */
CREATE SEQUENCE fp_dom_seq;
CREATE DOMAIN fp_dom_id AS integer DEFAULT nextval('fp_dom_seq');
CREATE TABLE fp_dom (id fp_dom_id PRIMARY KEY, val text, s integer, e integer);
SELECT periods.add_period('fp_dom', 'p', 's', 'e');
 add_period 
------------
 t
(1 row)

SELECT periods.add_for_portion_view('fp_dom', 'p');
 add_for_portion_view 
----------------------
 t
(1 row)

INSERT INTO fp_dom (val, s, e) VALUES ('a', 10, 40);
UPDATE fp_dom__for_portion_of_p SET val = 'b', s = 20, e = 30;
SELECT id, val, s, e FROM fp_dom ORDER BY s;
 id | val | s  | e  
----+-----+----+----
  2 | a   | 10 | 20
  1 | b   | 20 | 30
  3 | a   | 30 | 40
(3 rows)

SELECT periods.drop_period('fp_dom', 'p');
 drop_period 
-------------
 t
(1 row)

DROP TABLE fp_dom;
DROP DOMAIN fp_dom_id;
DROP SEQUENCE fp_dom_seq;
/*
 * §2.3(c): the slice INSERTs and the central UPDATE's SET list were built
 * from jsonb_each_text() output as quoted literals, so array values arrived
 * in JSON form ('[1, 2, 3]') and composites as JSON objects; any table
 * carrying such a column could not use FOR PORTION OF at all.
 */
CREATE TABLE fp_arr (id serial PRIMARY KEY, val integer, tags integer[], s integer, e integer);
SELECT periods.add_period('fp_arr', 'p', 's', 'e');
 add_period 
------------
 t
(1 row)

SELECT periods.add_for_portion_view('fp_arr', 'p');
 add_for_portion_view 
----------------------
 t
(1 row)

INSERT INTO fp_arr (val, tags, s, e) VALUES (100, ARRAY[1, 2, 3], 10, 40);
/* Updating an unrelated column must not trip over the array column. */
UPDATE fp_arr__for_portion_of_p SET val = 999, s = 20, e = 30;
SELECT id, val, tags, s, e FROM fp_arr ORDER BY s;
 id | val |  tags   | s  | e  
----+-----+---------+----+----
  2 | 100 | {1,2,3} | 10 | 20
  1 | 999 | {1,2,3} | 20 | 30
  3 | 100 | {1,2,3} | 30 | 40
(3 rows)

/* Updating the array column itself must work, too. */
UPDATE fp_arr__for_portion_of_p SET tags = ARRAY[7, 8], s = 20, e = 30;
SELECT id, val, tags, s, e FROM fp_arr ORDER BY s;
 id | val |  tags   | s  | e  
----+-----+---------+----+----
  2 | 100 | {1,2,3} | 10 | 20
  1 | 999 | {7,8}   | 20 | 30
  3 | 100 | {1,2,3} | 30 | 40
(3 rows)

SELECT periods.drop_period('fp_arr', 'p');
 drop_period 
-------------
 t
(1 row)

DROP TABLE fp_arr;
CREATE TYPE fp_pair AS (x integer, y text);
CREATE TABLE fp_comp (id serial PRIMARY KEY, val integer, pair fp_pair, s integer, e integer);
SELECT periods.add_period('fp_comp', 'p', 's', 'e');
 add_period 
------------
 t
(1 row)

SELECT periods.add_for_portion_view('fp_comp', 'p');
 add_for_portion_view 
----------------------
 t
(1 row)

INSERT INTO fp_comp (val, pair, s, e) VALUES (100, ROW(7, 'seven')::fp_pair, 10, 40);
UPDATE fp_comp__for_portion_of_p SET val = 999, s = 20, e = 30;
SELECT id, val, pair, s, e FROM fp_comp ORDER BY s;
 id | val |   pair    | s  | e  
----+-----+-----------+----+----
  2 | 100 | (7,seven) | 10 | 20
  1 | 999 | (7,seven) | 20 | 30
  3 | 100 | (7,seven) | 30 | 40
(3 rows)

SELECT periods.drop_period('fp_comp', 'p');
 drop_period 
-------------
 t
(1 row)

DROP TABLE fp_comp;
DROP TYPE fp_pair;
/* Known limitation: JSON carries no array bounds, so the slices' copies of a
 * non-1-based array are renumbered from 1 (the row updated in place keeps
 * its bounds).  This documents that behavior. */
CREATE TABLE fp_lb (id serial PRIMARY KEY, val integer, tags integer[], s integer, e integer);
SELECT periods.add_period('fp_lb', 'p', 's', 'e');
 add_period 
------------
 t
(1 row)

SELECT periods.add_for_portion_view('fp_lb', 'p');
 add_for_portion_view 
----------------------
 t
(1 row)

INSERT INTO fp_lb (val, tags, s, e) VALUES (100, '[0:2]={1,2,3}'::integer[], 10, 40);
UPDATE fp_lb__for_portion_of_p SET val = 999, s = 20, e = 30;
SELECT id, val, tags, array_dims(tags) AS dims, s, e FROM fp_lb ORDER BY s;
 id | val |     tags      | dims  | s  | e  
----+-----+---------------+-------+----+----
  2 | 100 | {1,2,3}       | [1:3] | 10 | 20
  1 | 999 | [0:2]={1,2,3} | [0:2] | 20 | 30
  3 | 100 | {1,2,3}       | [1:3] | 30 | 40
(3 rows)

SELECT periods.drop_period('fp_lb', 'p');
 drop_period 
-------------
 t
(1 row)

DROP TABLE fp_lb;
/*
 * §3.1: add_system_versioning() assembled the generated temporal helper
 * functions (__as_of, __between, __between_symmetric, __from_to) by
 * interpolating the SYSTEM_TIME period's column names with %I *inside* a
 * single-quoted function-body literal.  %I (quote_ident) does not escape the
 * single quotes that delimit that literal, so a column name containing one
 * closed the body early; with check_function_bodies = off the trailing text
 * ran as extra statements executed by the SECURITY DEFINER (superuser) owner --
 * arbitrary code / privilege escalation.  The bodies are now built with an
 * inner format() and embedded via %L, which cannot be broken out of (this also
 * protects a hostile schema or view name).
 */
/*
 * An injection-shaped end-column name must be stored and quoted as literal
 * text, never executed.  A temp-table marker proves whether the payload ran as
 * the definer; check_function_bodies = off removes the body-validation that
 * would otherwise mask the exploit.
 */
SET check_function_bodies TO off;
CREATE TEMP TABLE b31_marker (fired boolean);
CREATE TABLE b31_inj (
    id integer PRIMARY KEY,
    ss timestamptz,
    "e'; INSERT INTO pg_temp.b31_marker VALUES (true); --" timestamptz
);
SELECT periods.add_system_time_period('b31_inj', 'ss', 'e''; INSERT INTO pg_temp.b31_marker VALUES (true); --');
 add_system_time_period 
------------------------
 t
(1 row)

SELECT periods.add_system_versioning('b31_inj');
NOTICE:  history table "b31_inj_history" created for "b31_inj", be sure to index it properly
 add_system_versioning 
-----------------------
 
(1 row)

SELECT EXISTS (SELECT FROM pg_temp.b31_marker) AS injection_fired;
 injection_fired 
-----------------
 f
(1 row)

SELECT periods.drop_system_versioning('b31_inj', drop_behavior => 'CASCADE', purge => true);
 drop_system_versioning 
------------------------
 t
(1 row)

DROP TABLE b31_inj;
DROP TABLE b31_marker;
RESET check_function_bodies;
/*
 * A legitimately single-quoted period column name must work end-to-end: the
 * generated helper functions must be created and return the right rows.
 */
CREATE TABLE b31_ok (id integer PRIMARY KEY, val text, "s'" timestamptz, "e'" timestamptz);
SELECT periods.add_system_time_period('b31_ok', 's''', 'e''');
 add_system_time_period 
------------------------
 t
(1 row)

SELECT periods.add_system_versioning('b31_ok');
NOTICE:  history table "b31_ok_history" created for "b31_ok", be sure to index it properly
 add_system_versioning 
-----------------------
 
(1 row)

INSERT INTO b31_ok (id, val) VALUES (1, 'a');
SELECT val FROM b31_ok__as_of(transaction_timestamp()) ORDER BY val;
 val 
-----
 a
(1 row)

SELECT periods.drop_system_versioning('b31_ok', drop_behavior => 'CASCADE', purge => true);
 drop_system_versioning 
------------------------
 t
(1 row)

DROP TABLE b31_ok;
/*
 * sol.md T3: add_system_time_period() checked the requested start/end column
 * names against the unique keys of EVERY table, so a temporal unique key on an
 * unrelated table whose scalar columns share a name blocked adding SYSTEM_TIME.
 */
CREATE TABLE t3_other (sys_s integer, vf integer, vt integer);
SELECT periods.add_period('t3_other', 'validity', 'vf', 'vt');
 add_period 
------------
 t
(1 row)

SELECT periods.add_unique_key('t3_other', '{sys_s}', 'validity', key_name => 't3_other_uk');
 add_unique_key 
----------------
 t3_other_uk
(1 row)

CREATE TABLE t3_victim (id integer PRIMARY KEY);
SELECT periods.add_system_time_period('t3_victim', 'sys_s', 'sys_e');
 add_system_time_period 
------------------------
 t
(1 row)

/* A collision on the table itself must still be rejected */
CREATE TABLE t3_self (sys_s timestamptz, vf integer, vt integer);
SELECT periods.add_period('t3_self', 'validity', 'vf', 'vt');
 add_period 
------------
 t
(1 row)

SELECT periods.add_unique_key('t3_self', '{sys_s}', 'validity', key_name => 't3_self_uk');
 add_unique_key 
----------------
 t3_self_uk
(1 row)

SELECT periods.add_system_time_period('t3_self', 'sys_s', 'sys_e');
ERROR:  columns in period for SYSTEM_TIME are not allowed in UNIQUE keys
CONTEXT:  PL/pgSQL function periods.add_system_time_period(regclass,name,name,name,name,name,name,name,name[]) line 48 at RAISE
SELECT periods.drop_unique_key('t3_self', 't3_self_uk');
 drop_unique_key 
-----------------
 
(1 row)

SELECT periods.drop_unique_key('t3_other', 't3_other_uk');
 drop_unique_key 
-----------------
 
(1 row)

DROP TABLE t3_self;
DROP TABLE t3_victim;
DROP TABLE t3_other;
/*
 * sol.md T2: excluded_column_names accepted the SYSTEM_TIME period's own
 * start/end columns.  Excluding a bound column disables both the
 * GENERATED ALWAYS enforcement and the history write for updates touching
 * only that column, so the row-start timestamp became forgeable without
 * leaving any history.
 */
CREATE TABLE t2_excl (id integer PRIMARY KEY, val text);
SELECT periods.add_system_time_period('t2_excl', excluded_column_names => '{system_time_start}');
ERROR:  cannot exclude period column "system_time_start"
CONTEXT:  PL/pgSQL function periods.add_system_time_period(regclass,name,name,name,name,name,name,name,name[]) line 326 at RAISE
SELECT periods.add_system_time_period('t2_excl');
 add_system_time_period 
------------------------
 t
(1 row)

SELECT periods.add_system_versioning('t2_excl');
NOTICE:  history table "t2_excl_history" created for "t2_excl", be sure to index it properly
 add_system_versioning 
-----------------------
 
(1 row)

INSERT INTO t2_excl (id, val) VALUES (1, 'a');
UPDATE t2_excl SET system_time_start = 'epoch';
SELECT id, val, system_time_start = 'epoch' AS forged FROM t2_excl;
 id | val | forged 
----+-----+--------
  1 | a   | f
(1 row)

SELECT count(*) AS history_rows FROM t2_excl_history;
 history_rows 
--------------
            1
(1 row)

SELECT periods.set_system_time_period_excluded_columns('t2_excl', '{system_time_end}');
ERROR:  cannot exclude period column "system_time_end"
CONTEXT:  PL/pgSQL function periods.set_system_time_period_excluded_columns(regclass,name[]) line 47 at RAISE
/* Excluding an ordinary column must keep working */
SELECT periods.set_system_time_period_excluded_columns('t2_excl', '{val}');
 set_system_time_period_excluded_columns 
-----------------------------------------
 
(1 row)

SELECT stp.excluded_column_names
FROM periods.system_time_periods AS stp
WHERE stp.table_name = 't2_excl'::regclass;
 excluded_column_names 
-----------------------
 {val}
(1 row)

SELECT periods.drop_system_versioning('t2_excl', drop_behavior => 'CASCADE', purge => true);
 drop_system_versioning 
------------------------
 t
(1 row)

DROP TABLE t2_excl;
/* Custom bound column names must be looked up, not assumed */
CREATE TABLE t2_names (id integer PRIMARY KEY, val text);
SELECT periods.add_system_time_period('t2_names', 'my_start', 'my_end');
 add_system_time_period 
------------------------
 t
(1 row)

SELECT periods.set_system_time_period_excluded_columns('t2_names', '{my_end}');
ERROR:  cannot exclude period column "my_end"
CONTEXT:  PL/pgSQL function periods.set_system_time_period_excluded_columns(regclass,name[]) line 47 at RAISE
SELECT stp.excluded_column_names
FROM periods.system_time_periods AS stp
WHERE stp.table_name = 't2_names'::regclass;
 excluded_column_names 
-----------------------
 {}
(1 row)

DROP TABLE t2_names;
/* A table without a SYSTEM_TIME period: the setter stays a silent no-op */
CREATE TABLE t2_nop (id integer, val text);
SELECT periods.set_system_time_period_excluded_columns('t2_nop', '{val}');
 set_system_time_period_excluded_columns 
-----------------------------------------
 
(1 row)

DROP TABLE t2_nop;
/*
 * Defense in depth: a bound column that reached the catalog through an old
 * version (or a dump/restore of one) must be ignored by the C triggers, not
 * honored.  Poison the catalog directly as superuser to simulate that.
 */
CREATE TABLE t2_legacy (id integer PRIMARY KEY, val text);
SELECT periods.add_system_time_period('t2_legacy');
 add_system_time_period 
------------------------
 t
(1 row)

SELECT periods.add_system_versioning('t2_legacy');
NOTICE:  history table "t2_legacy_history" created for "t2_legacy", be sure to index it properly
 add_system_versioning 
-----------------------
 
(1 row)

INSERT INTO t2_legacy (id, val) VALUES (1, 'a');
RESET ROLE;
UPDATE periods.system_time_periods
SET excluded_column_names = '{system_time_start}'
WHERE table_name = 't2_legacy'::regclass;
SET ROLE TO periods_unprivileged_user;
UPDATE t2_legacy SET system_time_start = 'epoch';
SELECT id, val, system_time_start = 'epoch' AS forged FROM t2_legacy;
 id | val | forged 
----+-----+--------
  1 | a   | f
(1 row)

SELECT count(*) AS history_rows FROM t2_legacy_history;
 history_rows 
--------------
            1
(1 row)

SELECT periods.drop_system_versioning('t2_legacy', drop_behavior => 'CASCADE', purge => true);
 drop_system_versioning 
------------------------
 t
(1 row)

DROP TABLE t2_legacy;
/*
 * sol.md D2 (upstream #14): add_system_versioning() and health_checks()
 * formatted role names by applying %I to a regrole rendering, which is
 * already quoted, so any owner whose name needs quoting was looked up as a
 * role with literal double quotes in its name.  The grant-propagation loop
 * also rendered the PUBLIC pseudo-role (grantee OID 0) as "-", which is not
 * valid GRANT syntax.
 */
RESET ROLE;
CREATE ROLE "Bug14 Owner";
CREATE ROLE "Bug14 Successor";
CREATE ROLE bug14_pub_owner;
CREATE ROLE bug14_probe;
CREATE TABLE b14 (id integer PRIMARY KEY, val text, vf integer, vt integer);
ALTER TABLE b14 OWNER TO "Bug14 Owner";
SELECT periods.add_system_time_period('b14');
 add_system_time_period 
------------------------
 t
(1 row)

SELECT periods.add_system_versioning('b14');
NOTICE:  history table "b14_history" created for "b14", be sure to index it properly
 add_system_versioning 
-----------------------
 
(1 row)

/* The history objects must all belong to the table's owner */
SELECT c.relname, pg_catalog.pg_get_userbyid(c.relowner) AS owner
FROM pg_catalog.pg_class AS c
WHERE c.relname IN ('b14', 'b14_history', 'b14_with_history')
ORDER BY c.relname;
     relname      |    owner    
------------------+-------------
 b14              | Bug14 Owner
 b14_history      | Bug14 Owner
 b14_with_history | Bug14 Owner
(3 rows)

SELECT p.proname, pg_catalog.pg_get_userbyid(p.proowner) AS owner
FROM pg_catalog.pg_proc AS p
WHERE p.proname LIKE 'b14\_\_%'
ORDER BY p.proname;
        proname         |    owner    
------------------------+-------------
 b14__as_of             | Bug14 Owner
 b14__between           | Bug14 Owner
 b14__between_symmetric | Bug14 Owner
 b14__from_to           | Bug14 Owner
(4 rows)

/* health_checks' ownership realignment must handle quoted names, too,
 * including the FOR PORTION OF view */
SELECT periods.add_period('b14', 'validity', 'vf', 'vt');
 add_period 
------------
 t
(1 row)

SELECT periods.add_for_portion_view('b14', 'validity');
 add_for_portion_view 
----------------------
 t
(1 row)

ALTER TABLE b14 OWNER TO "Bug14 Successor";
SELECT c.relname, pg_catalog.pg_get_userbyid(c.relowner) AS owner
FROM pg_catalog.pg_class AS c
WHERE c.relname IN ('b14', 'b14_history', 'b14_with_history', 'b14__for_portion_of_validity')
ORDER BY c.relname;
           relname            |      owner      
------------------------------+-----------------
 b14                          | Bug14 Successor
 b14__for_portion_of_validity | Bug14 Successor
 b14_history                  | Bug14 Successor
 b14_with_history             | Bug14 Successor
(4 rows)

SELECT p.proname, pg_catalog.pg_get_userbyid(p.proowner) AS owner
FROM pg_catalog.pg_proc AS p
WHERE p.proname LIKE 'b14\_\_%'
ORDER BY p.proname;
        proname         |      owner      
------------------------+-----------------
 b14__as_of             | Bug14 Successor
 b14__between           | Bug14 Successor
 b14__between_symmetric | Bug14 Successor
 b14__from_to           | Bug14 Successor
(4 rows)

SELECT periods.drop_for_portion_view('b14', 'validity');
 drop_for_portion_view 
-----------------------
 t
(1 row)

/* Reconnecting a retained history table goes through the adoption branch */
SELECT periods.drop_system_versioning('b14', drop_behavior => 'CASCADE');
 drop_system_versioning 
------------------------
 t
(1 row)

SELECT periods.add_system_versioning('b14');
 add_system_versioning 
-----------------------
 
(1 row)

SELECT c.relname, pg_catalog.pg_get_userbyid(c.relowner) AS owner
FROM pg_catalog.pg_class AS c
WHERE c.relname IN ('b14_history', 'b14_with_history')
ORDER BY c.relname;
     relname      |      owner      
------------------+-----------------
 b14_history      | Bug14 Successor
 b14_with_history | Bug14 Successor
(2 rows)

SELECT periods.drop_system_versioning('b14', drop_behavior => 'CASCADE', purge => true);
 drop_system_versioning 
------------------------
 t
(1 row)

DROP TABLE b14;
/* A SELECT grant to PUBLIC on the base table must propagate, not break */
CREATE TABLE b14pub (id integer PRIMARY KEY, val text);
ALTER TABLE b14pub OWNER TO bug14_pub_owner;
GRANT SELECT ON b14pub TO PUBLIC;
SELECT periods.add_system_time_period('b14pub');
 add_system_time_period 
------------------------
 t
(1 row)

SELECT periods.add_system_versioning('b14pub');
NOTICE:  history table "b14pub_history" created for "b14pub", be sure to index it properly
 add_system_versioning 
-----------------------
 
(1 row)

SELECT pg_catalog.has_table_privilege('bug14_probe', 'b14pub_history', 'SELECT') AS probe_sees_history;
 probe_sees_history 
--------------------
 t
(1 row)

SELECT periods.drop_system_versioning('b14pub', drop_behavior => 'CASCADE', purge => true);
 drop_system_versioning 
------------------------
 t
(1 row)

DROP TABLE b14pub;
DROP ROLE "Bug14 Owner";
DROP ROLE "Bug14 Successor";
DROP ROLE bug14_pub_owner;
DROP ROLE bug14_probe;
SET ROLE TO periods_unprivileged_user;
