-- Model-output: Claude Fable 5
/*
 * Regression tests for bugs found in the 2026-08 code review
 * (ai-code-reviews/claude.md).  Section markers below refer to that
 * document's numbering.
 */
/* Run tests as unprivileged user */
SET ROLE TO periods_unprivileged_user;
/*
 * §2.1: dropping an application-time period must not tear down the table's
 * SYSTEM VERSIONING machinery, which belongs to the system_time period.
 */
CREATE TABLE dp_sysver (id integer PRIMARY KEY, val text, vs date, ve date);
SELECT periods.add_period('dp_sysver', 'validity', 'vs', 've');
 add_period 
------------
 t
(1 row)

SELECT periods.add_system_time_period('dp_sysver');
 add_system_time_period 
------------------------
 t
(1 row)

SELECT periods.add_system_versioning('dp_sysver');
NOTICE:  history table "dp_sysver_history" created for "dp_sysver", be sure to index it properly
 add_system_versioning 
-----------------------
 
(1 row)

INSERT INTO dp_sysver (id, val, vs, ve) VALUES (1, 'a', '2000-01-01', '2010-01-01');
SELECT periods.drop_period('dp_sysver', 'validity');
 drop_period 
-------------
 t
(1 row)

/* The system_time period, its triggers, and its constraint must survive. */
SELECT period_name FROM periods.periods WHERE table_name = 'dp_sysver'::regclass ORDER BY period_name;
 period_name 
-------------
 system_time
(1 row)

SELECT period_name FROM periods.system_time_periods WHERE table_name = 'dp_sysver'::regclass;
 period_name 
-------------
 system_time
(1 row)

SELECT count(*) AS sysver_rows FROM periods.system_versioning WHERE table_name = 'dp_sysver'::regclass;
 sysver_rows 
-------------
           1
(1 row)

SELECT count(*) AS row_triggers FROM pg_catalog.pg_trigger WHERE tgrelid = 'dp_sysver'::regclass AND NOT tgisinternal;
 row_triggers 
--------------
            3
(1 row)

SELECT count(*) AS infinity_constraints
FROM periods.system_time_periods AS stp
JOIN pg_catalog.pg_constraint AS c ON (c.conrelid, c.conname) = (stp.table_name, stp.infinity_check_constraint)
WHERE stp.table_name = 'dp_sysver'::regclass;
 infinity_constraints 
----------------------
                    1
(1 row)

/* History must still be written (the INSERT above was an earlier transaction). */
UPDATE dp_sysver SET val = 'b' WHERE id = 1;
SELECT val FROM dp_sysver_history;
 val 
-----
 a
(1 row)

SELECT periods.drop_system_versioning('dp_sysver', drop_behavior => 'CASCADE', purge => true);
 drop_system_versioning 
------------------------
 t
(1 row)

DROP TABLE dp_sysver;
/*
 * §2.3(b): update_portion_of() must match the edited row by its primary key
 * alone.  Matching on the columns of every constraint means a NULL in any
 * CHECK/UNIQUE/FOREIGN KEY-constrained column makes the central UPDATE match
 * nothing, while the pre/post slices are still inserted: the edit is silently
 * lost and the periods overlap.
 */
CREATE TABLE fp_nullable (
    id serial PRIMARY KEY,
    val integer,
    note text CHECK (note <> 'wrong'),
    s integer,
    e integer
);
SELECT periods.add_period('fp_nullable', 'p', 's', 'e');
 add_period 
------------
 t
(1 row)

SELECT periods.add_for_portion_view('fp_nullable', 'p');
 add_for_portion_view 
----------------------
 t
(1 row)

INSERT INTO fp_nullable (val, note, s, e) VALUES (100, NULL, 10, 40);
UPDATE fp_nullable__for_portion_of_p SET val = 999, s = 20, e = 30;
/* Expect [10,20) val 100, [20,30) val 999, [30,40) val 100; note NULL in all. */
SELECT id, val, note, s, e FROM fp_nullable ORDER BY s, e, id;
 id | val | note | s  | e  
----+-----+------+----+----
  2 | 100 |      | 10 | 20
  1 | 999 |      | 20 | 30
  3 | 100 |      | 30 | 40
(3 rows)

SELECT periods.drop_period('fp_nullable', 'p');
 drop_period 
-------------
 t
(1 row)

DROP TABLE fp_nullable;
/*
 * §4.1: insert_into_history()'s plan cache must re-plan exactly when the
 * history table's qualified name changes: not on every write (which leaks
 * one kept plan per history-writing statement), and never running a stale
 * plan after the history table changed both schema and name.
 */
CREATE TABLE pc_leak (id integer PRIMARY KEY, val integer);
SELECT periods.add_system_time_period('pc_leak');
 add_system_time_period 
------------------------
 t
(1 row)

SELECT periods.add_system_versioning('pc_leak');
NOTICE:  history table "pc_leak_history" created for "pc_leak", be sure to index it properly
 add_system_versioning 
-----------------------
 
(1 row)

INSERT INTO pc_leak (id, val) VALUES (1, 0);
UPDATE pc_leak SET val = 1;
UPDATE pc_leak SET val = 2;
UPDATE pc_leak SET val = 3;
UPDATE pc_leak SET val = 4;
UPDATE pc_leak SET val = 5;
/*
 * Count this backend's cached history INSERT plans: one per UPDATE when
 * leaking, exactly one when behaving.  pg_backend_memory_contexts needs a
 * superuser and PostgreSQL 14; on older servers just report the good value.
 */
RESET ROLE;
DO $do$
DECLARE
    n bigint := 1;
BEGIN
    IF current_setting('server_version_num')::integer >= 140000 THEN
        SELECT count(*) INTO n
        FROM pg_backend_memory_contexts
        WHERE ident LIKE 'INSERT INTO %pc_leak_history%';
    END IF;
    RAISE NOTICE 'cached history insert plans: %', n;
END;
$do$;
NOTICE:  cached history insert plans: 1
/* Changing both schema and name of the history table must cause a re-plan. */
CREATE SCHEMA pc_leak_hs;
ALTER TABLE pc_leak_history SET SCHEMA pc_leak_hs;
ALTER TABLE pc_leak_hs.pc_leak_history RENAME TO relocated_history;
UPDATE pc_leak SET val = 6;
SELECT val FROM pc_leak_hs.relocated_history ORDER BY val;
 val 
-----
   0
   1
   2
   3
   4
   5
(6 rows)

SELECT periods.drop_system_versioning('pc_leak', drop_behavior => 'CASCADE', purge => true);
 drop_system_versioning 
------------------------
 t
(1 row)

DROP TABLE pc_leak;
DROP SCHEMA pc_leak_hs;
SET ROLE TO periods_unprivileged_user;
/*
 * §2.2 (github issue #27): deleting or updating a referenced row must not
 * orphan children whose periods lie strictly inside the removed interval.
 * The old parent-side check looked only for children *containing* the whole
 * removed interval.
 */
CREATE TABLE fk_parent (id integer, s integer, e integer);
SELECT periods.add_period('fk_parent', 'p', 's', 'e');
 add_period 
------------
 t
(1 row)

SELECT periods.add_unique_key('fk_parent', ARRAY['id'], 'p', key_name => 'fk_parent_id_p');
 add_unique_key 
----------------
 fk_parent_id_p
(1 row)

CREATE TABLE fk_child (id integer, parent_id integer, s integer, e integer);
SELECT periods.add_period('fk_child', 'p', 's', 'e');
 add_period 
------------
 t
(1 row)

SELECT periods.add_foreign_key('fk_child', ARRAY['parent_id'], 'p', 'fk_parent_id_p', key_name => 'fk_child_parent_id_p');
   add_foreign_key    
----------------------
 fk_child_parent_id_p
(1 row)

INSERT INTO fk_parent VALUES (1, 0, 100);
INSERT INTO fk_child VALUES (1, 1, 30, 40);
/* Deleting or shrinking the parent across the child must be blocked. */
DELETE FROM fk_parent WHERE id = 1;
ERROR:  update or delete on table "fk_parent" violates foreign key constraint "fk_child_parent_id_p" on table "fk_child"
CONTEXT:  PL/pgSQL function periods.validate_foreign_key_old_row(name,jsonb,boolean) line 151 at RAISE
SQL statement "SELECT periods.validate_foreign_key_old_row(TG_ARGV[0], jold, false)"
PL/pgSQL function periods.uk_delete_check() line 22 at PERFORM
UPDATE fk_parent SET s = 35 WHERE id = 1;
ERROR:  update or delete on table "fk_parent" violates foreign key constraint "fk_child_parent_id_p" on table "fk_child"
CONTEXT:  PL/pgSQL function periods.validate_foreign_key_old_row(name,jsonb,boolean) line 151 at RAISE
SQL statement "SELECT periods.validate_foreign_key_old_row(TG_ARGV[0], jold, true)"
PL/pgSQL function periods.uk_update_check() line 23 at PERFORM
/* Changing the key while a child references it must be blocked. */
UPDATE fk_parent SET id = 2 WHERE id = 1;
ERROR:  update or delete on table "fk_parent" violates foreign key constraint "fk_child_parent_id_p" on table "fk_child"
CONTEXT:  PL/pgSQL function periods.validate_foreign_key_old_row(name,jsonb,boolean) line 151 at RAISE
SQL statement "SELECT periods.validate_foreign_key_old_row(TG_ARGV[0], jold, true)"
PL/pgSQL function periods.uk_update_check() line 23 at PERFORM
/* Changes that keep the child covered are allowed. */
UPDATE fk_parent SET s = 10, e = 90 WHERE id = 1;
SELECT id, s, e FROM fk_parent ORDER BY id, s;
 id | s  | e  
----+----+----
  1 | 10 | 90
(1 row)

SELECT id, parent_id, s, e FROM fk_child ORDER BY id, s;
 id | parent_id | s  | e  
----+-----------+----+----
  1 |         1 | 30 | 40
(1 row)

/* NO ACTION is deferred: replacing coverage within a transaction is allowed. */
BEGIN;
DELETE FROM fk_parent WHERE id = 1;
INSERT INTO fk_parent VALUES (1, 10, 35), (1, 35, 90);
COMMIT;
SELECT id, s, e FROM fk_parent ORDER BY id, s;
 id | s  | e  
----+----+----
  1 | 10 | 35
  1 | 35 | 90
(2 rows)

/* Removing an interior piece of the coverage must still fail at commit. */
BEGIN;
DELETE FROM fk_parent WHERE (id, s) = (1, 35);
COMMIT;
ERROR:  update or delete on table "fk_parent" violates foreign key constraint "fk_child_parent_id_p" on table "fk_child"
CONTEXT:  PL/pgSQL function periods.validate_foreign_key_old_row(name,jsonb,boolean) line 151 at RAISE
SQL statement "SELECT periods.validate_foreign_key_old_row(TG_ARGV[0], jold, false)"
PL/pgSQL function periods.uk_delete_check() line 22 at PERFORM
SELECT id, s, e FROM fk_parent ORDER BY id, s;
 id | s  | e  
----+----+----
  1 | 10 | 35
  1 | 35 | 90
(2 rows)

/* Once the child is gone, the parent can go too. */
DELETE FROM fk_child;
DELETE FROM fk_parent;
/* RESTRICT differs from NO ACTION only in timing in this extension. */
CREATE TABLE fkr_parent (id integer, s integer, e integer);
SELECT periods.add_period('fkr_parent', 'p', 's', 'e');
 add_period 
------------
 t
(1 row)

SELECT periods.add_unique_key('fkr_parent', ARRAY['id'], 'p', key_name => 'fkr_parent_id_p');
 add_unique_key  
-----------------
 fkr_parent_id_p
(1 row)

CREATE TABLE fkr_child (id integer, parent_id integer, s integer, e integer);
SELECT periods.add_period('fkr_child', 'p', 's', 'e');
 add_period 
------------
 t
(1 row)

SELECT periods.add_foreign_key('fkr_child', ARRAY['parent_id'], 'p', 'fkr_parent_id_p',
    key_name => 'fkr_child_parent_id_p', update_action => 'RESTRICT', delete_action => 'RESTRICT');
    add_foreign_key    
-----------------------
 fkr_child_parent_id_p
(1 row)

INSERT INTO fkr_parent VALUES (1, 0, 100);
INSERT INTO fkr_child VALUES (1, 1, 30, 40);
DELETE FROM fkr_parent WHERE id = 1;
ERROR:  update or delete on table "fkr_parent" violates foreign key constraint "fkr_child_parent_id_p" on table "fkr_child"
CONTEXT:  PL/pgSQL function periods.validate_foreign_key_old_row(name,jsonb,boolean) line 151 at RAISE
SQL statement "SELECT periods.validate_foreign_key_old_row(TG_ARGV[0], jold, false)"
PL/pgSQL function periods.uk_delete_check() line 22 at PERFORM
/* Extending the parent period keeps the child covered and is allowed. */
UPDATE fkr_parent SET e = 200 WHERE id = 1;
SELECT id, s, e FROM fkr_parent ORDER BY id, s;
 id | s |  e  
----+---+-----
  1 | 0 | 200
(1 row)

/* A self-referencing foreign key. */
CREATE TABLE fk_selfref (id integer, mgr integer, s integer, e integer);
SELECT periods.add_period('fk_selfref', 'p', 's', 'e');
 add_period 
------------
 t
(1 row)

SELECT periods.add_unique_key('fk_selfref', ARRAY['id'], 'p', key_name => 'fk_selfref_id_p');
 add_unique_key  
-----------------
 fk_selfref_id_p
(1 row)

SELECT periods.add_foreign_key('fk_selfref', ARRAY['mgr'], 'p', 'fk_selfref_id_p', key_name => 'fk_selfref_mgr_p');
 add_foreign_key  
------------------
 fk_selfref_mgr_p
(1 row)

INSERT INTO fk_selfref VALUES (1, 1, 0, 50);
INSERT INTO fk_selfref VALUES (2, 1, 10, 20);
/* id 1 is still referenced by id 2. */
DELETE FROM fk_selfref WHERE id = 1;
ERROR:  update or delete on table "fk_selfref" violates foreign key constraint "fk_selfref_mgr_p" on table "fk_selfref"
CONTEXT:  PL/pgSQL function periods.validate_foreign_key_old_row(name,jsonb,boolean) line 151 at RAISE
SQL statement "SELECT periods.validate_foreign_key_old_row(TG_ARGV[0], jold, false)"
PL/pgSQL function periods.uk_delete_check() line 22 at PERFORM
/* id 2 is referenced by nobody. */
DELETE FROM fk_selfref WHERE id = 2;
/* Now id 1 references only itself, and deleting it removes both sides. */
DELETE FROM fk_selfref WHERE id = 1;
SELECT id, mgr, s, e FROM fk_selfref ORDER BY id, s;
 id | mgr | s | e 
----+-----+---+---
(0 rows)

/*
 * Same-named referencing and referenced columns: the coverage query used to
 * correlate them without table qualification, so "id = id" collapsed into a
 * tautology and the key filter vanished, accepting orphans of other keys and
 * spuriously rejecting valid rows once different keys' periods overlapped.
 */
CREATE TABLE sn_parent (id integer, s integer, e integer);
SELECT periods.add_period('sn_parent', 'p', 's', 'e');
 add_period 
------------
 t
(1 row)

SELECT periods.add_unique_key('sn_parent', ARRAY['id'], 'p', key_name => 'sn_parent_id_p');
 add_unique_key 
----------------
 sn_parent_id_p
(1 row)

CREATE TABLE sn_child (id integer, s integer, e integer);
SELECT periods.add_period('sn_child', 'p', 's', 'e');
 add_period 
------------
 t
(1 row)

SELECT periods.add_foreign_key('sn_child', ARRAY['id'], 'p', 'sn_parent_id_p', key_name => 'sn_child_id_p');
 add_foreign_key 
-----------------
 sn_child_id_p
(1 row)

INSERT INTO sn_parent VALUES (1, 0, 20);
/* A child with a key that has no parent at all must be rejected. */
INSERT INTO sn_child VALUES (999, 5, 10);
ERROR:  insert or update on table "sn_child" violates foreign key constraint "sn_child_id_p"
CONTEXT:  PL/pgSQL function periods.validate_foreign_key_new_row(name,jsonb) line 130 at RAISE
SQL statement "SELECT periods.validate_foreign_key_new_row(TG_ARGV[0], jnew)"
PL/pgSQL function periods.fk_insert_check() line 20 at PERFORM
/* A properly covered child is accepted. */
INSERT INTO sn_child VALUES (1, 5, 10);
INSERT INTO sn_parent VALUES (2, 10, 50);
/* Overlapping periods of *other* keys must not confuse the check. */
INSERT INTO sn_child VALUES (1, 12, 18);
SELECT id, s, e FROM sn_child ORDER BY id, s;
 id | s  | e  
----+----+----
  1 |  5 | 10
  1 | 12 | 18
(2 rows)

/* Re-adding the foreign key revalidates existing data with the same query. */
SELECT periods.drop_foreign_key('sn_child', 'sn_child_id_p');
 drop_foreign_key 
------------------
 t
(1 row)

SELECT periods.add_foreign_key('sn_child', ARRAY['id'], 'p', 'sn_parent_id_p', key_name => 'sn_child_id_p');
 add_foreign_key 
-----------------
 sn_child_id_p
(1 row)

/* Clean up all foreign key test objects. */
SELECT periods.drop_period('fk_child', 'p', 'CASCADE');
 drop_period 
-------------
 t
(1 row)

DROP TABLE fk_child;
SELECT periods.drop_period('fk_parent', 'p', 'CASCADE');
 drop_period 
-------------
 t
(1 row)

DROP TABLE fk_parent;
SELECT periods.drop_period('fkr_child', 'p', 'CASCADE');
 drop_period 
-------------
 t
(1 row)

DROP TABLE fkr_child;
SELECT periods.drop_period('fkr_parent', 'p', 'CASCADE');
 drop_period 
-------------
 t
(1 row)

DROP TABLE fkr_parent;
SELECT periods.drop_period('fk_selfref', 'p', 'CASCADE');
 drop_period 
-------------
 t
(1 row)

DROP TABLE fk_selfref;
SELECT periods.drop_period('sn_child', 'p', 'CASCADE');
 drop_period 
-------------
 t
(1 row)

DROP TABLE sn_child;
SELECT periods.drop_period('sn_parent', 'p', 'CASCADE');
 drop_period 
-------------
 t
(1 row)

DROP TABLE sn_parent;
/*
 * §5.2: the bounds check constraint of a period must be protected from being
 * dropped (like the system_time infinity constraint already is), and
 * drop_period(..., purge => true) must not trip over its own protection, a
 * recursive teardown, or a constraint shared by another period.
 */
CREATE TABLE bcp (id integer, s integer, e integer);
SELECT periods.add_period('bcp', 'p', 's', 'e');
 add_period 
------------
 t
(1 row)

/* Dropping the bounds constraint out from under the period must be blocked. */
ALTER TABLE bcp DROP CONSTRAINT bcp_p_check;
ERROR:  cannot drop constraint "bcp_p_check" on table "bcp" because it is used in period "p"
CONTEXT:  PL/pgSQL function periods.drop_protection() line 304 at RAISE
/* And purging the period must work. */
SELECT periods.drop_period('bcp', 'p', purge => true);
 drop_period 
-------------
 t
(1 row)

DROP TABLE bcp;
/* CASCADE+purge of system_time with versioning tears down through
 * drop_system_versioning, which recurses into drop_period; the bounds
 * constraint must not be dropped twice. */
CREATE TABLE dtd (id integer PRIMARY KEY, val text);
SELECT periods.add_system_time_period('dtd');
 add_system_time_period 
------------------------
 t
(1 row)

SELECT periods.add_system_versioning('dtd');
NOTICE:  history table "dtd_history" created for "dtd", be sure to index it properly
 add_system_versioning 
-----------------------
 
(1 row)

SELECT periods.drop_period('dtd', 'system_time', 'CASCADE', purge => true);
 drop_period 
-------------
 t
(1 row)

SELECT periods.drop_system_versioning('dtd', drop_behavior => 'CASCADE', purge => true);
NOTICE:  table dtd does not have SYSTEM VERSIONING
 drop_system_versioning 
------------------------
 f
(1 row)

SELECT periods.drop_period('dtd', 'system_time', purge => true);
NOTICE:  period system_time not found on table dtd
 drop_period 
-------------
 f
(1 row)

DROP TABLE dtd;
/* Two periods adopting the same pre-existing CHECK constraint: purging one
 * period must leave the constraint for the other. */
CREATE TABLE shc (id integer, s integer, e integer, CONSTRAINT shc_se_check CHECK (s < e));
SELECT periods.add_period('shc', 'p1', 's', 'e');
 add_period 
------------
 t
(1 row)

SELECT periods.add_period('shc', 'p2', 's', 'e');
 add_period 
------------
 t
(1 row)

SELECT periods.drop_period('shc', 'p1', purge => true);
 drop_period 
-------------
 t
(1 row)

SELECT count(*) AS constraint_survives FROM pg_catalog.pg_constraint
    WHERE (conrelid, conname) = ('shc'::regclass, 'shc_se_check');
 constraint_survives 
---------------------
                   1
(1 row)

SELECT periods.drop_period('shc', 'p2', purge => true);
 drop_period 
-------------
 t
(1 row)

SELECT count(*) AS constraint_purged FROM pg_catalog.pg_constraint
    WHERE (conrelid, conname) = ('shc'::regclass, 'shc_se_check');
 constraint_purged 
-------------------
                 0
(1 row)

DROP TABLE shc;
